{"summary":"Three-day Mysuru heritage starter","days":[{"day_number":1,"date":"2026-08-10","items":[{"time":"09:00","title":"Mysuru Palace","category":"heritage","estimated_cost":"120.00"}]}],"budget_split":[{"category":"accommodation","amount":"7000.00"}],"warnings":[],"packing_items":["identity documents","walking shoes"]}

